[
  {
    "id": "msg-urgent-1",
    "provider": "gog",
    "account": "test",
    "mailbox": "INBOX",
    "subject": "URGENT: Production incident in progress",
    "from": [{ "name": "Ops Alert", "address": "ops@example.com" }],
    "to": [{ "address": "oncall@example.com" }],
    "cc": [],
    "receivedAt": "2026-04-03T08:00:00Z",
    "snippet": "ASAP — production database is showing elevated error rates",
    "labels": ["inbox", "unread", "important"],
    "attachments": [],
    "flags": { "read": false, "starred": true, "archived": false },
    "refs": { "providerId": "msg-urgent-1" },
    "meta": {}
  },
  {
    "id": "msg-newsletter-1",
    "provider": "gog",
    "account": "test",
    "mailbox": "INBOX",
    "subject": "Weekly Tech Digest - Issue #204",
    "from": [{ "address": "noreply@digest.example.com" }],
    "to": [{ "address": "user@example.com" }],
    "cc": [],
    "receivedAt": "2026-04-03T06:00:00Z",
    "snippet": "This week in tech: AI advances, new frameworks, and more",
    "labels": ["inbox", "category_promotions"],
    "attachments": [],
    "flags": { "read": false, "starred": false, "archived": false },
    "refs": { "providerId": "msg-newsletter-1" },
    "meta": {}
  },
  {
    "id": "msg-receipt-1",
    "provider": "gog",
    "account": "test",
    "mailbox": "INBOX",
    "subject": "Order confirmation #ORD-98765",
    "from": [{ "address": "noreply@shop.example.com" }],
    "to": [{ "address": "user@example.com" }],
    "cc": [],
    "receivedAt": "2026-04-02T22:30:00Z",
    "snippet": "Thank you for your order. Your receipt is attached.",
    "labels": ["inbox"],
    "attachments": [],
    "flags": { "read": true, "starred": false, "archived": false },
    "refs": { "providerId": "msg-receipt-1" },
    "meta": {}
  },
  {
    "id": "msg-reply-needed-1",
    "provider": "gog",
    "account": "test",
    "mailbox": "INBOX",
    "subject": "Re: Project kickoff meeting",
    "from": [{ "name": "Alex Johnson", "address": "alex@example.com" }],
    "to": [{ "address": "user@example.com" }],
    "cc": [],
    "receivedAt": "2026-04-03T10:00:00Z",
    "snippet": "Could you respond with your availability? Please reply by end of day.",
    "labels": ["inbox", "unread"],
    "attachments": [],
    "flags": { "read": false, "starred": false, "archived": false },
    "refs": { "providerId": "msg-reply-needed-1" },
    "meta": {}
  },
  {
    "id": "msg-calendar-1",
    "provider": "gog",
    "account": "test",
    "mailbox": "INBOX",
    "subject": "Invitation: Weekly standup @ Mon Apr 7",
    "from": [{ "address": "calendar-notification@example.com" }],
    "to": [{ "address": "user@example.com" }],
    "cc": [],
    "receivedAt": "2026-04-03T07:00:00Z",
    "snippet": "You have been invited to Weekly standup",
    "labels": ["inbox"],
    "attachments": [],
    "flags": { "read": false, "starred": false, "archived": false },
    "refs": { "providerId": "msg-calendar-1" },
    "meta": {}
  }
]
